negara,review,rating
Filipina,so many players who doesn't know how to play.,1
Filipina,bagi team betul lah mende siak moonton ni main kat honor macam dekat epic sial,2
Filipina,likes,5
Filipina,please improve your matching system there are too many cancers many dark system.,1
Filipina,"perbaikin sistem matchingnya lah, gausah ketemuin mawi sama imo, ngapain anjingg?? imo 400 imo 500 ketemu mawi x honor anjg tolol ya",1
Filipina,"pemain nya kasar semua, dan sombong",1
Filipina,Why its keep saying tab to review your back performence? But noting happen when i tab..,2
Filipina,really great love that they have ao many heroes to choose from,5
Filipina,game hama ls terus hapus aja,2
Filipina,they are scamming people for nothing taking their money I hate this game from now on,1
Filipina,Worst matchmaking system ever created,1
Filipina,where do i even start. i have played 5 games in a row in ranked. all games have afk player who either just stand around at towers at base or just plain down afk. than u get people who lock in to roles 3 at bottom lane and go afk later. this is by FAR! the worst mobile game ever made BY FAR! and u cant even report these fools because the game said there is nothing wrong with what they did. what a joke like the devs that made this game! wouldnt even rate this game 1 star.,1
Filipina,Good Game gg,5
Filipina,"this game making kids stressed soo much , i recommend not to play this game cause it making you stressed",1
Filipina,because of your match making at binibigay mo sakin mga obob ayusin mo na binigay mo sakin na kakampe puro 8080 LAHAT binibigay mo na PI ka,1
Filipina,suka,5
Filipina,monton pls hapus dark sistem di game lu gua sudah koyak dengan dark sistem di game lu,3
Filipina,"it's lagging even though i have a stable internet connection,when i play other games it doesn't lag it's stable,lol fix this",1
Filipina,bad teammate trash talk,2
Filipina,moontoon ayusing mo yung matchmaking mo puro balbg dark system aba ano yun 1 panalo katumbas 3 talo aba ayusi aba!!!!!! sumosobra na,1
Filipina,"Если Вам нравится полное отсутствие баланса в каждом матче, то это игра для Вас!",1
Filipina,I hate you Moonton.,1
Filipina,sobrang lala ng match making,1
Filipina,Moonton please fix the lag issue..and also the matchmaking system that everyone was talking about.I have been playing this game for 5 years and recently the matchmaking system is bad..i always get an inexperienced player on my teammate.. i think i will move on to HOK instead.but overall ML is better.,5
Filipina,nice game,5
Filipina,HOK is better👎👎👎,1
Filipina,good game,5
Filipina,bulok matchmaking,1
Filipina,amazing,5
Filipina,interesting and attractive game I just love it 💗😩👌🏻🩵,5
Filipina,I am mad I uploaded a pic of my selfie a good selfie me posting a peace sign siting pic and I got banned for a few days for what??? Now I am really mad about this I have been playing this game for decades and literally purchased a lot of diamonds in this game and spent a lot of money and it happened like this. If my account happened something I will be so mad and you should refine everything,2
Filipina,Good game,5
Filipina,"Stres games ever, dislike it, tq for your server",1
Filipina,this game is so bad moonton giving me dark system team and I got lose strea 10 times so do not install this game this shocks,1
Filipina,This game is nothing but a trash🗑️,1
Filipina,Fix the matchmaking system. Players aren't getting paired with players of the same rank or number of stars.,3
Filipina,moonton is stupid like asf.,1
Filipina,terrible matchmaking!,1
Filipina,playful moment with mlbb 5 star for me,5
Filipina,so easy,1
Filipina,abcze,5
Filipina,I give an 1 star because all my team it's like ah bot player or computer even I played in ranked all deafet putangina delete ko na lang tong ml walang nagbago Panay bobo kakampi,1
Filipina,yuck your matchmaking,1
Filipina,I didn't for 2 or 3 years all my progress got deleted because it said it had no data don't play this game,1
Filipina,good,5
Filipina,nice game,5
Filipina,Poor match making not balance,1
Filipina,I need heros plz,5
Filipina,ดี,5
Filipina,Cing atuh dia Aing teh ek ka glory berean atuh menang kikir kikir teuing😒😒,1
Filipina,Goodame player,5
Filipina,help,5
Filipina,we can search for a friend on this game,5
Filipina,it's so cool a,5
Filipina,"u sohai, I spend my money and then u give me full lose streak ?? omg u beach",1
Filipina,its so lagging its been 1 month and the game is still on lag why moonton didn't fix this stuff when i played the ping is alright but the game crash and turn the ping into 300ms and sometimes it turns into 12ms what is happening???,1
Filipina,"Expensive game, not good for kids. Bad game",1
Filipina,nice and good,5
Filipina,brooo bring back the. old aurora!!!,1
Filipina,MARAMING MGA BATA NA MGA BOBO MAG LARO PURO HINDI MARURUNONG,1
Filipina,soo good but i want cool skin trial,5
Filipina,Trying Fanny,5
Filipina,"NO WONDER MOBILE LEGENDS IS GOING DOWN, THE MATCHMAKING IS UNFAIR ENEMY IS VERY GOOD AT PLAYING BUT MY TEAM HAVE VERY VERY WEAK IQ BRUHHH",1
Filipina,"I rate this as 1 star kase madaya yung matching epic ako tapos yung mga kalaban mythic ba so dumb ng facilitation ❌ you better fix this montoon or we gonna quit your game! yes until now ang bobo ng mga kasama ko tapos ang kalaban ang lalakas like bobo kaba anung laban ng lima ng magaling sa isa? lima nga kami pero paramg AI kung mag laro mga teammates ko , matching experience is napaka unfair bwisit",1
Filipina,"tangina mo montoon kaya andami na umaalis sa laro, kahit umalis ka ng ilang araw ambobo parin ng kampi, gusto gawa skins, ayos matchmaking ayaw? Lala mo montoon, nakakastress na laro mo, hindi na enjoyable tulad ng dati, ayusin mo naman matchmaking please lang",1
Filipina,matchmaking is unfair,1
Filipina,nice,5
Filipina,IT'S SO FUNN,5
Filipina,this game so excited,5
Filipina,the teammate is dark system i am always mvp but it's always lose so can you level up the teammate bobo!!!,1
Filipina,Good game I'm all time enjoy this game 😊,5
Filipina,walang kwentang matchmaking kakampi ko ba naman malayo sa rank ko tapos yung mga kalaban ko napakataas nang rank ampota walang kwentang laro sana hindi nalang ako bumalik sa game nyo di nyo parin inayos yung gameplay yung matchmaking wala paring kwentaa,1
Filipina,"Bro giving me a animal team,lol",1
Filipina,hellow Mlbb please fix the match making I'm a solo player bot I'm always have a team mate of duo and trio please fix this,1
Filipina,so boring this game so manidark system,1
Filipina,very bad game very bad matchmaking very very bad network issue dont play this game,1
Filipina,Moontoon matchmaking are getting worse and worse. match with people who feed and troll is nonsense. Why would someone even invest to pay for in game experience if your game experience is full of nonsense matches? Unfair matchmaking game. Make you lose stars for no reason due to unbalanced matchmaking. How can you match player who are veteran with 3 or 4 other players that are not experienced vs whole other team that are all experienced?,1
Filipina,honor of kings are better than this game the honor of kings is much better games This mobile legends bangbng it it's a not good game my rates in this mobile legends are -0/10 and the honor of kings are perfect 100/10 mobile legends bangbng are sucks boooo 🤮🤮👎👎,1
Filipina,This is good and obsession game,3
Filipina,"So far they have time to make new skins and making it look fabulous, but what about the matchmaking? No progress since 2022, i highly doubt they won't even improve it like be fr its been years now what are the devs doing?Why not give us the team that we wanted it's always those mindless players. So far the worst game when it comes to matchmaking lol",1
Filipina,ezz my account kena hacker,3
Filipina,Nowadays trash taking are very much common in this game which is very much disturbing. Its like a assaulting with mouth. I don't know if MBL monitors them or just ignore them.There should be huge punishment for players like them.sometimes some player abuse others just to cover their own mistakes which are mistaken by others & they also join together to bully a particular one.,3
Filipina,"Very disappointed with the matchmaking system. Whenever I have a winning streak, I suddenly get very inexperienced teammates while the enemy team gets strong, coordinated players. Out of around 200 matches, I can accept 50–60 losses were my fault, but most others were due to unbalanced teams. It feels unfair and frustrating. Please fix the matchmaking to make it truly skill-based and balanced and latest I have deleted the game because of continuous problem very bad experience",1
Filipina,"I really want to play this game because when I have nothing else to do, this is what I play and this game also relieves fatigue.",5
Filipina,Can't log in into my google account.,1
Filipina,"The hero voice, huhu. Its lost. I tried repairing the resources, still no in-match hero voices.",4
Filipina,I love it cause I like it. and I'm Mythical glory,5
Filipina,its good,5
Filipina,Make it a 6v6,4
Filipina,good,5
Filipina,switch account issue ( via Google ),1
Filipina,i love it but i hate it when im always dying haha,5
Filipina,this game is so good to play ngl,5
Filipina,matchmaking is terrible!,1
Filipina,"moonton please fix this it's so weird whenever I play this game my ping is always high,but when I finish the match the ping it's super smooth like jelly and yet you say I'm afk it's keep happening I'm stressed like crazy, moonton please fix that it's so weird in lobby it's okay match making it's okay too but in match it's turn really high.please fix it i always stressed went that keep happening,I know you ignore my email and the other too but please fix your game properly..",1
Filipina,bodohh,1
Filipina,game bocil kok udah ancem bunuh2an,1
Filipina,I love it,5
Filipina,I quit this game has dark system All I want was to have fun I hate you fill your match making.,1
Filipina,😍😍,5
Filipina,wonderful game. I'm playing always mobile legend bang bang my favorite game he is better than free fire but character his choice anything and and alti use,5
Filipina,yes I'm,1
Filipina,Ahuqba,5
Filipina,sana may skin na one piece,5
Filipina,Puro bobong kampi pinapakampi sakin ehhh buti ung codm maganda bulok na laro,1
Filipina,very nice game 👍,5
Filipina,"lag every single rangked game, sepanjang minggu ini. event dan skin dibanyakin, server dibiarin. game rusak",1
Filipina,"this game is so fun especially you play with your friends. In here, you can pick any hero you want. it so funnn",5
Filipina,Love it,5
Filipina,what a game...match making is trash 👎👎👎👎👎,1
Filipina,I have no words,5
Filipina,nice game,5
Filipina,subrang lala mo,1
Filipina,moonton remove darksystem 😡😡😡😡😡,1
Filipina,"Hate this game,the players that team with me is always so dumb",1
Filipina,it is so nice game,5
Filipina,bagusan pubg,1
Filipina,RIGGED MATCHES FULL OF DARK SYSTEMS I WILL NEVER PLAY THIS GAME AGAIN IF I COULD'VE GIVE THIS ZERO STAR I WOULD DO!,1
Filipina,good game,5
Filipina,net is too much slow I can't even play and react,1
Filipina,"Regarding the matchmaking update of this game, I can honestly say that they still haven’t taken proper action to fix it. In fact, it feels like it has only gotten worse. I don’t even know if I’m the one at fault as a player, or if the matchmaking system of Mobile Legends: Bang Bang is truly unfair. I sincerely hope they address this issue soon because the game itself is really good. The only thing I truly dislike is the matchmaking system it is extremely, incredibly frustrating.",1
Filipina,myat noe,5
Filipina,umay sa signal,1
Filipina,"always unstable network with Good ping,????????",1
Filipina,"this app is good but, every time there's a new update or release of new skins it becomes so buggy Ang laggy even thoe I. have good internet or good signal it still lags pls fix your game.",1
Filipina,putanginamo puro dark system kakampi bobo ng matchmaking nyo,1
Filipina,good game I love it,5
Filipina,it's so amazing game,5
Filipina,I get ban for no reason your game sucks,1
Filipina,"dark system so muchhhhhhhhh, i hate this game, never gonna play anymore",1
Filipina,best giler,5
Filipina,it's good game,5
Filipina,"I've been playing this ml since 2020, High quality and good graphics but there's many darksytem player so i quit playing ml. Im tired playing Moonton fix you lobby. Hays",1
Filipina,"sangat tidak bagus buat hilangakan stress, sangat tidak bagus game anjjj tidak guna",1
Filipina,matchmaking suck,1
Filipina,jimboy lazaro,5
Filipina,Very good,5
Filipina,overally best but gave two star just for the worst ranking system in life I usually get good or MVP rating while my teammate always on 3.0 and I won one game then lost two game how am I able to increase my rank to mythic like this,2
Filipina,I like it very much this is my hobby game,5
Filipina,super good game,5
Filipina,fantastic game,5
Filipina,super Ganda😀,5
Filipina,I like these games because may cellphone it's low storage,5
Filipina,I Like Aulus and popol and kupa,5
Filipina,"there's barely no point at getting ur rank higher anymore. it requires a squad to even win nowadays you can barely solo rank because of unfair matchups like what's the point anymore if the games are barely fair and forgiving as it is not my skill issue, I have an equal amount of MVP losses and MVP wins as a solo so it's really just the garbage matchups with the enemies always getting an advantage",1
Filipina,it's super good,5
Filipina,all goods Kasi almost 8years na Akong nag I ML ngayon lang ako nkarating ng mythic Kung kailan mag I end season na hahhaa,5
Filipina,puro bobo kampi,1
Filipina,tiirulj vadjin,5
Filipina,your game is trash please add more good people and stop eating my star,1
Filipina,It's fun,5
Filipina,I used to love mlbb but the revamps are gradually making the visual portraits of the heroes sharpy or geometric. Not realistic anymore unlike in the past which was peak. I dont care if youre just aiming for friendliness to poor devices bcs you can buy cheap phone that can withstand long time gaming,2
Filipina,Apa masalah mobile legen ni.. Line pin 300,1
Filipina,terrible experience with matchmaking,1
Filipina,last season kona tangina ayaw manlang ayos mga nakakasama sa solo king ina nakakasawa na,1
Filipina,"i only play 1 ranked per day because it never lends me any good teammates, it just gives me a few wins then just takes it away losing 2x more than gained stars. as a solo there should be more advantages to atleast make it a fair fight but it has no mercy for solo players making it barely possible to get anywhere without some sort of team.",1
Filipina,🎮👍💪👑,5
Filipina,I enjoyed playing this game but moonton is so unfair he make me team at darksystem players,5
Filipina,so best,5
Filipina,aku suka mobile legen,5
Filipina,stupid banning account without using any violation,1
Filipina,the best game,5
Filipina,Toxic players bad matchmaking...,1
Filipina,үнэхээр гоё тоглоом шүү та нар бас тоглоорой амжилт 😁😙☺️🤗,5
Filipina,lala paki bawasan gb sa ml halos 10.94 gb kawawa tao sayo yah,5
Filipina,it's have nice quality and some of it is good heroes but problem is while u playing it's gonna be disconnected/reconnect and then leave in team automatically... but all of this is good must try!,5
Filipina,"bad game, always give noob team and hard enemy at the same time...I always got lose streak because of loser system from moonton, so poor service",1
Filipina,"matchmaking sampah, ketemu player hama 9x berturut turut, bangkrut aj dh ini game",1
Filipina,"Mau dapat tim bagus solo rank? Mau gampang naik immortal? Solusinya sering-sering top up diamond. Saya perhatiin ini Moontoon systemnya disetel berdasarkan akumulasi berapa diamond yang udah dihabiskan playernya. Pay to glory. Contohnya, kenapa player yang sering top up sampai berjuta-juta bisa gampang naik ke glory ataupun Immortal? Tak peduli dia solo rank atau tidak. Player yang masuk kasta menengah atau yang sesekali top up, paling mentoknya sampai glory 50. Itupun setengah mati. Game pepek",1
Filipina,the experience is good all is good but the only that I hate is when player/enemy playing unfair and also they are doing a bad decision pls update this pls revamp bad heroes and rebuff op heroes,4
Filipina,"rubbish game,control winlose",1
Filipina,I like it!,5
Filipina,verry nice ang verry injoy to play,5
Filipina,i wish we have free dias,5
Filipina,bogoo kaau imong match makinggg,1
Filipina,matchmaking nya ga seimbang,4
Filipina,this game it's making so many unfair and dog system 🤬🤬🤬🤬🤬🤬🤬🤬🤬,1
Filipina,mlbb mo bulok,1
Filipina,asal setiap kali mati lebih 5 coklat eh sikit2 coklat,1
Filipina,this game is so cool you must try it now 🇵🇭,5
Filipina,The matchmaking is so unfair,1
Filipina,KASI TIM YG BENER LAH KOCAK,2
Filipina,in 3 years I'm playing Im still in legend and don't change our ranked bc I worked hard in it,5
Filipina,"Gameplay is smooth and platform for play amazing but the system is incredibly flawed for reporting bad players, so be prepared to be banned from play by bad actors who claim and blame junglers who get slaughtered by 3 or 4 vs, while they create the problem. System supports lane abandonment, so at higher tiers it's almost impossible to progress and rep them is a waste of your life. report system is ai so it can't count to potato and it's that corrupt social credit system, go figure.",1
Filipina,so good,5
Filipina,great game,5
Filipina,This game is frustrating. One bad teammate can ruin everything. More stress than fun.some heroes are unbalanced. 👎🏻👎🏻👎🏻,1
Filipina,i will enjoy the way i win this kind of this game,5
Filipina,I am so disappointed this game system. We should boycott. Moontoon server can't fix this matching system and matching me with no brain no skill levels player.,1
Filipina,"I love this game, I lost 20 times in rank",5
Filipina,es muy adictivo,1
Filipina,it's.the best games ever,5
Filipina,so good mobile game. I'm Badang pro.I play with my friends and my brother. I'form in myanmar. I'Love this is game.,5
Filipina,"I've been playing this game since 2019. This app became a part of my daily routine actually. But last month, I just topped up for the M7 skin and purchase 4 weekly pass in the Codashop. Then my phone got factory reset and my ML account got hacked. And the CS said they can't do anything to retrieve it despite the multiple evidence of my ownership. It's so dissapointing how an account can get easily hacked by others but it's hard for the owners to retrieve it themselves. It's just unfair.",1
Filipina,Great,1
Filipina,"I played ml for how many years and this year is the worst 2026. The picking of players which they say is equally fair by combining good players and noob players together. Which is not recommended because those who know how to play will bring noob players to higher ranks which is unfair for those good players that can't rank up because of other noob players. IN MY OPINION, THEY SHOULD CONSIDER COMBINING GOOD PLAYERS TOGETHER EVEN ONLY IN RANK MATCHES. MOONTON PLEASE FIX THIS. I LOVE MLBB, OK.",1
Filipina,I'm crine I keep crashing out Lmfaooo still love this app,5
Filipina,the game is really suck to play....they keep changing Hayabusa and kagura lore that's why they deserve 1 star rate,1
Filipina,is very cool,5
Filipina,I give it a five star because of its creativity and it can teach you to strategies,5
Filipina,scam mo montoon ubos savings ko sa KOF wla nakoha sa pattern,1
Filipina,5 star na oh Winstreak nyo nako,5
Filipina,absolutely great,5
Filipina,Game rusak Matchmaking 100% tidak pernah balance.. rank epic d i aurih lawan rank glory imo terus2an.. dpt rim epic gm master terus.. game kont..,1
Filipina,"The matchmaking system is very unfair. I am currently Mythic Honor but frequently matched against Mythic Glory players, while my team has no Mythic Glory at all. This creates a huge imbalance and makes the game frustrating. Please improve the matchmaking system to ensure fair and balanced matches. lol moonton👎",1
Filipina,game gajelas pake script diban apalah,1
Filipina,very amaxing :),5
Filipina,so good,5
Filipina,Putang ina mo moonton tang ina log ako Di kana sana nag palaro ng ml kung log lng naman,1
Filipina,new the mobile legends of the fall of Rome new the next few days are in the month of the next few months ago,5
Filipina,its kinda laggy to meet,3
Filipina,yawa,1
Filipina,PEAKKK,5
Filipina,i hate you moontoon it was promo diamonds event currently i wanted to get a skin if you have a lot of promo diamonds the skin that has the same amount of cost as much as your promo diamonds can cost 1 real diamond at most i left home to go to school i had 2 real diamonds and when i came back it is gone and they didnt event atleast give me battle points i hate you moontoon i wish you see this review and fix it plz can you atleast check on my account details or data i want compensation for damage,1
Filipina,bias moontoon gusion is the winner of votings but Freya got the M8 skin the hell,1
Filipina,This is good👍,5
Filipina,bad game,1
Filipina,bad match making,1
Filipina,amazing,5
Filipina,👌🏻,5
Filipina,ok,5
Filipina,bad match making also ai team enemy pro,1
Filipina,good,5
Filipina,"put@ng!nańg yan, bakit nag reset yung bingo ng kof? ang lala... dami ko ng nagastos tapos ganun. Ang pangit pa ng skin na nakuha ko grabe. Naka limang 10× draw ako bago nakakuha ng kof skin tapos biglang na reset. Tapos sa every na pang sampung draw, imbes na yung epic skin na wala sakin yung ibigay... hindi, binigay sakin yung owned skin!!! What a trash game... ayusin nyu naman!!! put@ng!ńa!!!",1
Filipina,stress,1
Filipina,I like it,5
Filipina,"UNBALANCED MATCHMAKING, THIS IS NOT A PLACE FOR WINDING, STILL 1 STAR BANNING SOMEONE FOR NO REASON",1
Filipina,I just got banned I'm just playing with fair I'm just a normal player but I banned I hate this game,1
Filipina,This game my favourite game 🎮🎯,5
Filipina,worst experience in years. Has the worst match making of any game. even if given feedback now action. why does 85% winrate match with trash player in epic. add: again why does glory get matched with legends and mythic but enemy is full glory 6 matches of straight troll. and gets muted wrongly and the customer service never responds. 6 years of this game and Now I regret,1
Filipina,hi this game is very nice 👍,1
Filipina,good,5
Filipina,good,5
Filipina,bulbol tang ina ang tatanga ng mga player mo moontoon,1
Filipina,"liked the game, the graphics, the characters, all of it. two stars were removed only because that the matchmaking in ranked mode takes so long in some way that makes me even forget why am i here",3
Filipina,Literally the game rn is not like the old days game sucks now,1
Filipina,"makasi toon, gw jadi sayang sm emel skrg",5
Filipina,good game,5
Filipina,dmion,5
Filipina,game ni sangat best,5
Filipina,lag,1
Filipina,ayusin mo muna match making mo bago ka mag labas ng skin tanginamo Kang laro ka,1
Filipina,I like turtles,4
Filipina,Exciting game plaing since 2016 dec. So please be polite in some event to much dias can't still get the prize i want.why the latest billing or purchasing is only USD cant use my smart billing cause I can't change the payment method😭😭😭now no payment method again what ia happening,5
Filipina,best,5
Filipina,keep giving benefits to every player,5
Filipina,I don't like it I LOVE IT PLAY NOW,5
Filipina,I like it guys because he is excited to play with me when I get home from school so I want to play with him,5
Filipina,so fun enjoyable 😃 it's the best,5
Filipina,"why are you using literal alarms for notifications, you just interrupted me while I was doing something and i have to turn it off by opening my phone instead of silencing it via volume controls? also, IT BYPASSED MY DND",1
Filipina,saya suka game ini sbb suka bikin saya narik darah,5
Filipina,the draw event sucks...like kof event it is a scam,1
Filipina,might change rating if i am lucky with my free pulls,1
Filipina,i give this game 1 star because even if you are a pro gamer there are lots of dum to cary . every time i play i am always pared with week players/dark system gamers and this is the reason i always lose the game,1
Filipina,leeeeee sever ever lag,1
Filipina,Trash matchmaking,1
Filipina,LOLLLLLLLLLLLLLLLL,1
Filipina,☘️,5
Filipina,trash,1
Filipina,nice game.....,5
Filipina,game babi,1
Filipina,ML LEBIH BAGUS DARIPADA HOK,5
Filipina,you're the best mobile game ever,5
Filipina,game sampah matchmaking menjijikkan,1
Filipina,"I got a lot of Friends, happy and joyful",4
Filipina,game apaan matchnya gaada yang bener kikir banget lagi,1
Filipina,"Good game, but i wish there were gay heroes loll",5
Filipina,if montoon give us free collecter skin again,1
Filipina,3.6 hahahaha,1
Filipina,"gusion m8 did not win, time to delete this game",1
Filipina,game sampah tak ya download,1
Filipina,my wish is being top global johnson!,5
Filipina,gamenya jelek tiba-tiba lag gajelas pas war padahal sinyal bagus,1
Filipina,LS always moontoon:),1
Filipina,I was just afk for a moment and then became afk when the game ended.,1
Filipina,the heck with dark system,1
Filipina,"l like it because it's so good ,meet my friends and family",5
Filipina,epic gajelas,1
Filipina,The worst matching ever. fix its.,1
Filipina,ang pangit ng match making puro troll na player Yung kinakampi Sakin,1
Filipina,server lemot,1
Filipina,I keep reconnecting when I'm playing even though my internet line bar is full 4G and I still have kuota 6GB left,1
Filipina,VERY BAD MATCHING. ALWAYS GROUPED TO DARK SYSTEMS. I'LL CHANGE THIS REVIEW IF YOU DO SOMETHING ABOUT THIS ISSUE.,1
