negara,review,rating
Indonesia,sangat puas,5
Indonesia,"game kikir, gj strees ngasih tim epic hdh",1
Indonesia,Game sudah bagus tapi kurangnya kalau mau ganti akun harus punya fb meta kalau pakek fb lite gk bisa ganti akun tolong lah montoon,5
Indonesia,bagus game nya tp kadang servernya down ga bisa di apa apain,4
Indonesia,banyak drak sistem,1
Indonesia,"game hama, matchmaking gejelas, server rusak, user toxic. smg cepet bankrut dah.",1
Indonesia,"GAME BURUK, PLS LAH KALO ORG PICK HERO JANGAN PICK HERO YG BEDA LANE, JADINYA DAPAT DARK SISTEM. ITU MALESNYA MAIN ML. JADI GA MOOD MAIN ML. DITAMBAH LAGI JARINGAN BUSUK! PADAHAL LANCAR! CUACA CERAH TETEP NGELAG. TOLONG LAH MOONTON PERBAIKI SEMUANYA, UDAH LA MIJAK LEGEND TURUN LAGI KARNA DAPAT TIM DARK SYSTEM. TRUS JUGA HERO YG LAGI META DI NERF, TOLONG LAH MOONTON JANGAN BIKIN KAMI KECEWA SAMA GAMEMU!!",1
Indonesia,L ga rekomen buruk busuk ga bagus alahhhhhhhh jelek,1
Indonesia,gamenya bagus,5
Indonesia,gem jembut,1
Indonesia,"mogahan monton memberi diamond gratis untuk ku agar bisa membeli skin gratis amin ,tunggu 5 menit baru dibuat afk, dan jangan turun season mulu",5
Indonesia,benerin tuh sistem macmaking nya tolol,1
Indonesia,geme ini seru menatap pokoknya,5
Indonesia,game main di kasi dark sistem mulu game burik,1
Indonesia,"saya mohon buatkan fitur mvp(kalah) mohon bintangnya tetap naik,agar menghargai orang yg udah gendong eh timnya kek Pel*r,saya tunggu updatenya",1
Indonesia,game rusak wifi bagus tapi in game malah ngelag,1
Indonesia,aneh bikin stress,1
Indonesia,"game nya seru, bisa ngilangin setres",5
Indonesia,geme penghilang stress🗿,5
Indonesia,knp kok sekarang jaringan jadi merah terus SMA kuning padahal wifi masih baik baik aja bisa main blood streak masih aman kok,3
Indonesia,"game ini terlalu minus soal jaringan, masa main game rank classic dll harus ada wifi? kalo ga ada wifi nge lag nya minta ampun hadehh",1
Indonesia,😙,3
Indonesia,"leg bngat babi, padahal jringan gw lancar lo, ada apa si🤬🤬🤬🤬",1
Indonesia,game ini yng sangat aku bikin marah dan sinyal bagus pas di pencet tempat sinyal ping atau merah perbaiki moonton jangan banyak sekin mlu,5
Indonesia,game kontol,1
Indonesia,pelayanan yang lambat,1
Indonesia,👏🏻👏🏻🤙🏻,5
Indonesia,"masa aku cuma cek foto profil, GA MASUK ke profilnya, keliatan di pengunjung terakhir, malu x9999, kan aku udh g deket ama dia, ckp tw dis is kejam, saya me gue malu,, ini harusnya bintang satu tp aku baik y",5
Indonesia,"1. pas main jaringan tiba2 hilang 2. ini pasti bug di aplikasi 3. pas main ( ngeleg, dan pas mati jaringan bagus) kan bngke 4. ini sejak diupdet setelah korona, mkin jelek aplikasi",1
Indonesia,apalah sekalinya di mainin udah menang langsung di kasih tim dark sistem memang monton gak layak buat game ini,1
Indonesia,moonton lu pls bisa gak sih gak usah kasih gw draksystem roam floryn padahal gak ada tb STOP KASIH GW DRAKSYTEM GW LAGI MAIN TRIO lu malah kasih kita 2 orang draksytem,1
Indonesia,game kikir tiap gacha pola bingo selalu dapet pola 50/60 draw,1
Indonesia,membosankan di kasih team parah .......game semoga hilang c*k,1
Indonesia,"Sorry, but I won't be spending my money on games that don't care about trash players who can't even play properly that you put together with me on my team. At least, ban players from playing for 24 hours after they get bronze 3 times in a day.",1
Indonesia,"permainan sistem , ada waktunya menang dikasih team yg jago tar tbtba dikasih team yg baru baru maen yg kurang jago . jadi menurut gue gak worth it mobile legend ini . pokonya ini apk tolong hapus jgn di download",1
Indonesia,game ini sangat seru dan eamah,5
Indonesia,ini kenapa setiap mau naik renk di kasih tim dark sistem sedangkan musuhnya tinnya kaya toblonal tolong di perbaiki kesalahan itu saya sedikit lagi mau naik ke lejen 3 tahun saya belum naik ke lejen,1
Indonesia,game bagus banget sampai saya di kasi ls 13 kali menang cuman 4 sangat rekomendasi buat kalian yang ingin mempunyai adrenalin apalagi di mainin di bulan puasa sangat rekomendasi.buat moonton kalo ngasih tim itu yang bagus jangan ada nomer togel saya stres mau naik imo malah ketemu sama legend sedangkan tim musuh imo sama glory itu tidak adil apalgi ini bulan puasa jangan membuat orang Batal puasa syaa main game buat hiburan bukan stress astaghfirullah kalo bisa kasih syaa ws ya masyaallah,5
Indonesia,seru ko,5
Indonesia,"game dalemnya terlalu banyak darksestem trus stiap kli main qt yg udah honor di kasih 1 team sama legend itu juga klo mainnya solo rank ketemu orang"" gak jelas permainan apa ini game te, game apdet terus tapi isinya banyakan darkasistem masih banyak juga yg nge cheat jaringan pas main lag parah",1
Indonesia,"game merugikan pemain, musuh nya jago tapi timnya anomali, walaupun di rank tinggi tetap aja masih ada yang main mirip pemula, minimal kalo musuh nya jago tim nya juga jago atau normal, ini gak tim nya pada troll mending hapus aja ini gam",1
Indonesia,mas moonton mitak hp atau dm,5
Indonesia,game burik banyak dark sistem juga sistem pembagian player tidak adil,1
Indonesia,sangat bagus game ini walau pun GK pernah naik ke mitik,5
Indonesia,moonton tolong jauhin dark system pliss moonton pliss AKU UDAH KASIH BINTANG LIMA JANGAN DI READ DOANG BACA MOONTON PLISSSSSSSS MOONTON PLISSSSSSSS BANGETT BACA SEKALI AJA TERUS JAWAB YAAAAA MOONTON!!!!!!!!!,5
Indonesia,bagus banget game nya jangan lupa kasi diamond min,5
Indonesia,TIM NYA MONTOON HADEH,1
Indonesia,ini game babi,1
Indonesia,"Tiap main tidak pernah mendapatkan tim yang sesuai dengan harapan player, dari awal bermain sampai saat ini tidak ada perkembangan sekecil apapun, saya kecewa dengan cara bagaimana Moonton memberikan tim kepada player, kalau sistem game ini pay to win, saya tak akan pernah memberi rating di atas bintang 1",1
Indonesia,cih,1
Indonesia,Game kontol,1
Indonesia,gua habis gacha kartu pas match making terus dapet kartu lagend terus pas gua cancel match making nya gua gak dapet kartunya cok. seenggak nya dapet lah yah kan udah gaca terus dapet kartu legend lah ini kagak ludes semua jir skin hadiah gak dapet kesempatan gacha juga abis gak jelas sistem moonton,1
Indonesia,mlbb adalah game mobile online yang terbaik dan cerdas,5
Indonesia,sukaaaa pwoll sama game ini pokoknya love banget buat game ini 😖😖😖😖😖,5
Indonesia,gem lol,1
Indonesia,masih dgn darksitem nya apalagi maen Solo rungkad mau topup berapun juga gak bakal menang maen ini game .semoga ada penggantinya saingan dgn apk kont&l ini kaga jelas njirrrr .apalgi udah turun seoson ketaun banget darksitem nya . game t*ii ini ko*t®l,2
Indonesia,ini seru banget dah,5
Indonesia,"emosi gw anjj udh posisi menang malah ngelag sampe gk bisa gerak, ini dari server mlnya atau gimana jembot udah berkali kali gw ngalamin kalau soal performa hp gw pake infinix gt 20 masa ngelag jembot emosi gw sampe turun rank gara gara ngelag doang anjj anjj",1
Indonesia,seru banget bisa main sama temen atau sama doi gua seru kadang kadang ada bug nyeleneh tapi bisa juga ketemu tim dark sistem,5
Indonesia,"sebenarnya, ini game ada potensi tapi ,kalo udah masuk ke rank honor atau glory , pasti ada aja Cheater berkeliaran pless ada joki joki akun ngga jelas ,sama server yang udah tua banget, game busuk ngapain di update muluk, game Yahudi!",1
Indonesia,seruu banget stresny jdi berkurangg,5
Indonesia,bagus,5
Indonesia,👍👍👍👍👍👍👍👍👍,5
Indonesia,woi dark sistem hapus,1
Indonesia,kasi aku diamond gratis,5
Indonesia,untuk monton itu Fanny bagus kalo ada skin Spiderman di season ini cara menangin nya dengan ada misi tapi no daymen 😁,5
Indonesia,seru,5
Indonesia,game yang menghabiskan waktu,1
Indonesia,siuuuusuuu,5
Indonesia,Makasih mobil legen,3
Indonesia,gameplay bagus tapi pengurasan ram nya terlalu kuat sehingga mudah untuk lag tolong untuk tingkatkan lagi,4
Indonesia,main solo di rank mythic selalu dapet darksistem yang sangat dark bikin emosi saat puasa dari mythical glory jadi mythic biasa,1
Indonesia,perbaiki bug stuck di memuat game padahal jaringan sama device bagus stuck Mulu di memuat game,1
Indonesia,Perbaikan jaringan min ............,1
Indonesia,game nya mantap dan bagus banget,5
Indonesia,game kocak dark sistem semua isinya,1
Indonesia,seruu bangett,5
Indonesia,kalah terus,1
Indonesia,"kenapa saya kadang kena bug jaringan? padahal game sebelumnya dan setelahnya ga ada masalah jaringan, dan bukan cuman saya, kami 1 tim kena bug ini, dan gg nya lagi musuh juga kena sehingga sering mati konyol, ga wajar sih harus giff gw skin legend",1
Indonesia,monton tolong lah Adain di fitur kontrak Hero skin kof plis gw mau trial nya 1 sesek pliss MONTON,3
Indonesia,Karena ada bug yg ga di bener benerin bug nya pas selesai darf pick ngeleg parah ga bisa mencet apa apa tolong lah di perbaiki moonton merugikan banget jadi lama msuk in game nya + LS 11×,1
Indonesia,oi nonton tolong servernya di perbaiki,5
Indonesia,"tolol tololsistem matchmaking nya dungu amat anjg anjg bot nyasar di tim, pepekkkk,sering di cl tim gua komputer tim musuh glory, imo, honor, sring ya ini ga jarang memektiap main cl ls ls ls gua mau belajar combo pepek",1
Indonesia,menyenangkan kadang menyebalkan kadang juga bikin emosi.,5
Indonesia,saya suka dengan gameplay nya tapi ada kerumitan saat melawan musuh,5
Indonesia,"seru, tapi tolong dalam matchmaking lebih adil lagi",5
Indonesia,Saya suka sepanjang lawannya seimbang.,5
Indonesia,"Saran saya, semua Hero di (mode offline) semua Hero di gratis in. Biar ga bosan",1
Indonesia,knp si jaringan ny kyk babi,1
Indonesia,𝒔𝒂𝒏𝒈𝒂𝒕 𝒎𝒆𝒏𝒚𝒆𝒏𝒂𝒏𝒈𝒌𝒂𝒏,5
Indonesia,"sangat buruk asal masuk pertarungan selalu lag,badahal jaringan bagus gak jelas",2
Indonesia,jaringan makin gak stabil kadang lag eror jalan sendiri gak jelas,1
Indonesia,oke,5
Indonesia,geme ini Sagat bagus sekali betewe gua uda epik.🙏,5
Indonesia,"kof pola 6 diskasih aurora, emang jw developer",1
Indonesia,biasa aja,5
Indonesia,"Game labil, jaringan bagus tapi begitu masuk in-game, jaringan langsung down. udah gitu g teratur lagi, kadang di early, mid dan late suka rusak jaringan-nya. g worth it buat dimainin sama orang emosian😮‍💨😮‍💨",1
Indonesia,pengen masuk e-sport,5
Indonesia,jelek,1
Indonesia,kerennnn,5
Indonesia,"tolong lah buat monton, saya mau memulihkan akun ML saya. jadi masalahnya akun gmail saya yang terkaitkan ke akun monton kena hack akun gmailnya jadi kalau mau login lagi harus pake kode Verifikasi, sementara akun gmail nya kena hack orang. login jalur tiktok juga tetap sama harus minta kode verifikasi saya minta pemulihan akun masa harus ada screenshotan pertmana kali top up,sementara saya main ML itu tahun 2018 season 6 device nya juga udah beda tolong lah monton bantu proses saya.",2
Indonesia,woi moonton aku mau login ml malah memuat game terus menerus aku udah daritadi,1
Indonesia,game nya susah buat solo rank,1
Indonesia,seak montoon kalah gua anj game anj kalah mulu gua gent tim anj dari lu anj g. e. t. t. o. t lu monton,1
Indonesia,tolong perbaiki leg dalam gems,3
Indonesia,game haram dapat tim kek Kon*** jem**** ngen****,1
Indonesia,game stresss,1
Indonesia,bagus kok nostalgia,5
Indonesia,aku dh main beberapa kalii tapi ketagihan hehe bagus bgt sih ni game 😆😆😆,5
Indonesia,monton knp cepet kali turun seson aku blum mitick loh mana banyak tim yg ke. binatang,3
Indonesia,pretty good,5
Indonesia,dikasih losetreak mulu,5
Indonesia,"inii bagaimana? setiap aku main baru login udah dikasih tim darksistem, algoritma berantakan glory tiba tiba muncul legend, tim lawan sangat dominan sedangkan tim sendiri tidak mau bekerja sama, player nya juga gitu cabul, egois, pemarah dan sangat tidak ramah ini sebenarnya game atau membuat mental lemah?",2
Indonesia,"di ksih bintang 5 bkn ny ubah diri makin gelo, noh mkn satu biji gua ksih, adil dikit sm player solo anj",1
Indonesia,game apa ini sering ngelek padahal jaringan bagus trus dikasi tim draksistem Mulu,2
Indonesia,game yang sangat seru,5
Indonesia,"tolong banget, kasih tim yang seimbang lah, uda gitu ketemu tim yg asal pick hero, ngetroll, cape bgt lahh ls smpe 11×",1
Indonesia,bantu naik ke mytic dong monton,5
Indonesia,aku suka main ml ya,5
Indonesia,game yg keren,5
Indonesia,"jaringannya tolong di perbaiki min,gw lagi kontes turtle malah ngelag parah🙏",1
Indonesia,gem gak bagus burik babi,1
Indonesia,bagus cuma sedikit lag aja,5
Indonesia,sehat moonton?,1
Indonesia,game jelek matchmaking ancur,1
Indonesia,bagus bgt bisa mabar lagi 🎀🎀🎀,5
Indonesia,"kecewa sama Monton MLBB saya player baru, pengen ke rank matic tapi di persulit terus, ketemu tim noop tapi musuhnya pro",1
Indonesia,DEBU UNGGU DEBU UNGGU DEBU UNGGU 🤣🤣🤣🤣,1
Indonesia,bagus game nya,5
Indonesia,terlalu banyak makan data. sehingga bermain tidak nyaman selalu ngelag.,1
Indonesia,game apa ini GK dikasih menang SMA sekali tim nya tolol kali kalo ada rating nol gua kasih nol ini,1
Indonesia,game bodoh gk jelas apalah kalah terus gk ada yang bantu giliran musuh beda,1
Indonesia,moonton yang baik kasih tim yang bagus kenapa plis lah kasih tim itu yang jagoo,3
Indonesia,game bosokk jaringan bagus tpi lag parahhh,1
Indonesia,"e montoon gw udah main bareng ama teman masih blom selesai juga iventnya ,montong tolol o",4
Indonesia,GAME GILA BIKIN GILA,1
Indonesia,"PERBAIKI SISTEM MATCHMAKING, WIN CUMA SEKALI LOSTNYA BERKALI KALI. MANA NGASI TIM GAJELAS BAGIAN NGASIH LAWAN PADA KERAS. CUKUP KIKIR AJA, JANGAN SAMPE GA ADIL JUGA, KITA CAPE NGEPUSH GAADAA HASILNYA. PERBAIKI LAH!!! GAME BURUK BGT GA BIKIN PLAYERNYA HAVE FUN, MALAH MAKIN STRESS.",1
Indonesia,"ini game napa dahh, sering kali jaringan nya ping, dan saat waar lag nya ga ketolong, plis monton tolong di perbaiki",1
Indonesia,yatim dikasih timm pepek,1
Indonesia,"gamenya seru tapi, developer bodoh banget ngasih tim kayak kntl mulu, sampe ls 10x gliran ws cuma 2x paling banyak 3-4 kali, emang dongo ini yang buat game ga mikirin perasaan orang orang",1
Indonesia,"MATCHMAKING NYA KOCAK, DAPET 1 TIM ORANG ORANG ANEH, ADA YANG NGE TROLL ADA YANG BAPERAN, ADA YANG FEEDER, LENGKAP.",1
Indonesia,good,5
Indonesia,"kenapa saat saya main rank selalu di kasi tim yang jadi beban di tim saya , jadi buang waktu, niat nya mau naikin rank malah jadi turun rank nya karna di kasi tim yang ga jelas? serius nanya dan saya harap ada jawaban!?",1
Indonesia,"woyy moonton, benarin lah matchmackingnyaa, masa gw immo ketemu ama honor, gmna sihhhhh",1
Indonesia,Seru,5
Indonesia,suka banget soal nya bagus fps nya 100☺☺,5
Indonesia,Susah dapet tim beban Mulu anjjj,1
Indonesia,awesome,5
Indonesia,pelit bintang dasar kikir eh ku uninstal nanti ya ini eh bodoh menguji kesabaran dasar pelit china pelit sipit dasar aku doain bangkrut kau camkan itu anak biawak burik burik burik pelit pelit kikir kikir kikir kikir anak biawak,1
Indonesia,game byk flayer boot PD GK becus main...trus bayk sinyal tiba2 ngelek . game apa ini,1
Indonesia,sinyal lu benerin update aja di gedein sinyal merah trs setan,1
Indonesia,banyak dark sistem,1
Indonesia,habis ws 5 masa di kasih tim nya langsung bot,1
Indonesia,game yg sangat bagus isinya orng orng ber iq 99999+ mantap apalagi natan ama lukas,1
Indonesia,monton sekarang bak banget terimakasih loh monton karna kasih gua satu batu maaf ya monton kata kata gua semalam maaf yg paling dalam ini sekali lagi makasi monton tercinta,5
Indonesia,gk enak game sial bikin losetreak bikin malas main game lol moton haram,1
Indonesia,solo bot,3
Indonesia,"Ayolah MOONTON perbaiki server game nya lah, lagi main ngelag padahal jaringannya bagus, udah ngelag ga dapet poin protection tambahan lagi. jadi tolong ya MOONTON perbaiki masalah server atau apalah itu yang bikin ngelag biar pas main lancar, biar ga ngelag² lagi di gameplay nya, jadi tolong selesaikan masalah ya MOONTON",1
Indonesia,rem-nya seru,5
Indonesia,"tolong perbaiki lagi, kasih time dan lawan yang seimbang, masa Lawanya jago time nya dongo tolong perbaiki lagi, beri keadilan digeme ini",1
Indonesia,jujur gk ada masalah tapi kemauan gw kasi rating satu aja gitu,1
Indonesia,game bagus tapi susah main nya los trik mulu,5
Indonesia,well played!,1
Indonesia,monton kasih menang lah cape ls terus udah gua kasih bintang 5,5
Indonesia,méh,5
Indonesia,mantull,5
Indonesia,jangan download game ini guys nanti darah kalian naik,1
Indonesia,Game rusak,1
Indonesia,game nya seru,5
Indonesia,gj anying dapet tim gjls,1
Indonesia,"game gak bener, isinya kasar mana tim gua dikasih tim autis Mulu, kesel anj ml jelek",1
Indonesia,mending main game lain aja game nya gak adilll gak jelass setiap main bukan 5 vs 5 tapi 1 vs 9 udahh digendong cape cape main malahh kalahh gak adill banget tim nya lagi gak ngerti itemm udahh di kondisi kalah malahh beli sky apaan dahh kalo lu mau main rank baca dulu pungsi item nya ya ajingg Jagan asall mainn lahh hargain dikitt yang mau naikin bintang lahh gua cape cape udahh ngegendong malahh di trolll apaan hargain lahh yang udahh ngegendong capeee main malahh kalahh game gak adillll,1
Indonesia,game GK jelas. jirr bikin stresss doank GK pernah dah evaluasi dari pembagian timm yg lebih adill kek atau apa kek dah lh mlesas,2
Indonesia,gue gabisa main ml lagi karena ml tidak menagapi,5
Indonesia,seru banget bree,5
Indonesia,ya gitu stres dikit,5
Indonesia,Saya kasih bintang lima karena monoton selalu ngasih tim derak sistem,5
Indonesia,bagus dan bagussss,5
Indonesia,i like ML,5
Indonesia,game aneh giliran dapat tim gg sinyalnya malah jelek pas dapat tim yang beban sinyal nya Bagu ML anehh tololll,1
Indonesia,cuma ke warung bentar di hitung afk💔💔,1
Indonesia,bagusssss,5
Indonesia,game ini saat kita ingin naik rank di persulit dan membuat setres,1
Indonesia,seruu,5
Indonesia,Game yang Mengngesal kan drak sistem mulu gk pernah menang mode serius kawan trol😡😭😮‍💨😮‍💨 hapus aja game gak guna habis sin duit aja,1
Indonesia,game kumpulan orang pengangguran cik 😂🫵,1
Indonesia,ayo lah kalau kasih tim tu yang sepadan sama lawannya masak tim guwe lebih jago dari musuh guwe los treak gak wajar di tambah guwe makek roam,5
Indonesia,bagus,5
Indonesia,seru banget!!tapi gitu banyak tim lawan jago tapi tim sendirinya gajelas ini aku kasih bintang5 dulu tapi montoon tolong ya bantuin masalah yang saya keluhkan,5
Indonesia,"mohon untuk memperbaiki dulu sistem pencarian match karena saya sering bertemu tim atau lawan yang tidak seimbang karena dapat menyebabkan penurunan rank karena teman yang tidak seimbang. maka dari itu perbaiki dulu sistem yang membuat semua player ml stress, sebelum membuat fitur baru.",2
Indonesia,seru banget pokoknya game nya,5
Indonesia,mudah ngelek,4
Indonesia,"seru banget gamenya guys, jadi jangan lupa download dan kasih rating bintang 5 ya",5
Indonesia,"ML ANJINGGGG MA GF JADI NANGIS GARA GARA U, MATCH MAKING BENERIN BANGSATTT SEBELUM GW ANCURIN KANTORNYA",1
Indonesia,mantap,5
Indonesia,dapet tim drak sistem Mulu heran gua kali' tim yng bener gitu,1
Indonesia,I think this game is very good but maybe you should update it a little bit and this is one of my favorite games I really like it,5
Indonesia,banyak yg trol ml ngasi tim gak bisa main ditim musuh musuh nya jago jago di tim sendiri gak bisa main percuma banyak event tapi ditim gak seimbang,1
Indonesia,lose trek,1
Indonesia,apaan sihh moonton mah kaya gitu aku masa lose treak Mulu padahal mau mythic 😭😭😭😭😭,3
Indonesia,agak gak seimbang,2
Indonesia,akhirnya glory,5
Indonesia,"Makasihnya Moonton udh bikin game Mobile Legends makasih ya, maaff bangett klo gua dku ngatain kamu mulu maaff yaa,Eee.... Moonton tolong dong resale skin thamuz nexus sea... 😌",5
Indonesia,"tinggal kan monton sekarang pindah ke game sebelah SMA aja kok ,, monton payah sekarang kadang di kasih tim bagus kadang di kasih tim paling jelek ,, aku main 1 x menang 7x kalah ,, buat kawan2 tinggal kan monton beralih ke game sebelah enak d game sebelah ,, aku jga baru 3 hari main rank udah naik",1
Indonesia,"ketemu tim aneh,gamenya juga aneh,moonton aneh",1
Indonesia,seru,5
Indonesia,monton bisa buat game kasih klh terus,1
Indonesia,pas saya mau naik epik 4 malah kalah abis itu menang abis itu kalah abis itu menang memang salah kita buat naik rank apa sampe digituin itu aku dah 3thn loh masalahnya dah lah cape,1
Indonesia,game apaan ni mau naik rank nya aja ga bisa minimal kasi game yg ngotak la banyak yang drak sistem lagi,1
Indonesia,MATCHMAKING GOSONG MINUS TON MOONTON,1
Indonesia,muuntun bagong,1
Indonesia,bantu balikin akun aku yang di hack orang☹️☹️,1
Indonesia,tolong monton hilangkan lah drak sistem capek los terus monton mohon di hilangkan drak sistem nya 🙏,1
Indonesia,"bagus moonton,saya sangat suka game ini,sampe saya pengen psikolog gara² di kasih ls 5x berturut-turut,padahal saya tidak pernah ws.ya pokoknya seperti itu dh moonton,sangat baik moonton memberikan para playernya ls,SAYA SAMPE GILA MOONTONNNNN!!!!!",5
Indonesia,kenapa mesti 1 bintang naik rank mesti kalah tolong perbaiki lagi moonton dan lawan yang tidak seimbang tim musuh ada ex mitik 20 la timku epik abadi semua,3
Indonesia,apaan anjir wifi buat scroll tiktok dll lancar kalo buat main malah lag padahal wifi full,1
Indonesia,sistem gk jelas dikasih tim gk sesuai sama kemampuan pas di kasih sesuai kemampuan malah jelek karna kita kalah gegara main sama tim jelek jadi kemampuan di anggep jelek padahal tim nya yang jelek gk adil banget kalo kalah musuhnya bikin stress diri bukan buat hiburan,1
Indonesia,dapet tim troll trus cape,1
Indonesia,keren,5
Indonesia,moonton asu,1
Indonesia,game apasih ini banyak ngelegnya,1
Indonesia,gamenya sangat seruuu,5
Indonesia,sya suka geme ini kata saya gaada kekurangan nya ya kekurangan nya itu cuma di player nya aja makasi juga mlbb skin hanabi gratis nya sya juga suka skin nya jadi sya makasi banget buat mlbb☺️,5
Indonesia,di kasih tim tolol terus,1
Indonesia,cuma game ini yg battle g seimbang....kebnykan drac sistem,1
Indonesia,aku agak menykai ml,4
Indonesia,ini sangat cocok untk saya ini buat saya senang☺️☺️🤏🏻🤏🏻,5
Indonesia,Yang buat mlbb moga cepet MATI Monton mending hapus aja game nya dari play store ga guna game jelek kayak yang buat,1
Indonesia,saya kamu kasih kalah mulu mau saya hapus nih game moonton*1 karena game merusak mental,1
Indonesia,game nya jelek dikasih tim draksistem mulu,1
Indonesia,permainan seru juga bisa main offline,5
Indonesia,di kasih tim yang gak bener,1
Indonesia,game banyak bug ga jls gw dikasih dark sistem mulu aneh aneh tolong dibaca ya moonton,1
Indonesia,Wow,5
Indonesia,"entah kenapa setiap main pasti di kasih kalah,gw ada salah ya sama elu? makanya lu kasih aku kalah trus?",1
Indonesia,saya jadi lebih senang bermain ini,5
Indonesia,"game nya bgs , dan aku suka main ini, tapi problem nya pliss kasih lawan jgn yg kemampuan nya lebih tinggi, tapi buat keseruan aku suka bgttt",5
Indonesia,sangat bagus dan menarik,4
Indonesia,mending hapus aj ni game,1
Indonesia,game nya bagus saya menyukainya,5
Indonesia,monton ini bot nya aneh gamau maju di turet Mulu di benerin kek bot nya bikin susah tau ga.,2
Indonesia,game aneh,1
Indonesia,sangat buruk,1
Indonesia,gem yg tidak seibang antara lawan dengan musuh jaringan yg buruk dan banyak musuh yg pakek cit dan perilaku tak normal,3
Indonesia,"game Jelek Wifi udh bgs Masih aja Lag Game Aneh Kikir, Udh Tau Sekarang udh Bulan Puasa Masih Aja Di bikin Lag Trs Gua Aneh lo moonton kikir, 1 kata Buat Moonton LoL Lu Moonton!!! G ush Main ni Game Guys Sekali main Di bikin lag mulu Gua Ama Moontod Ni",1
Indonesia,monton Maruk sayaa mau mitic di kasih tim darks sistem nama saya di ml rillzz aja dasarrr luu bangke monton bikin kesel pemain lu sendiri loll lol,1
Indonesia,"sebenarnya buat fitur di dalam game udah bagus, tapi kenapa kita afk sebentar doang di bilang afk, contoh kita pengen ke toilet trus kita afk sebentar tetapi pas kita main lagi sampai akhir game tulisannya kita afk kayak kita itu afk nya dari awal sampe akhir. jadi aku minta tolong ke moonton yang afk sebentar jangan di tulis akhir game nya kita afk. dah itu aja sih. makasih",4
Indonesia,Dark system,1
Indonesia,"game nya asik, tapi kalo ngasi kawan itu yang bener lah, masa ngasi kawan yang gak bisa main🙏🙄",5
Indonesia,saya kembali lagi ternyata roblox tidak sebaik moonton aku suka moontod,5
Indonesia,"WOE MOONTON,BENERIN DLU TUH SERVER LU ANJ KALO KEK GINI PLAYER JUGA JADI GAMOOD MAEN KOCAK,GAJELAS BENER LU. LAGGG BANGETTT SUMPAH,SELALU PAS MAU NGELUARIN SKIL LAG NYA GA NGOTAK, PENCET SKIL SEKARANG KELUARNYA ABIS LEBARAN....gila",1
Indonesia,kont*l banyak player sampah,1
Indonesia,gak usah main game ini gak sesuai soalnya draft pick nya team nya pokoknya minusbanget lah team dapet yang trol trus,1
Indonesia,baik dan sangat ramah nih Game,5
Indonesia,RAFKA ananda MODESAD,5
Indonesia,ngasih tim yang bener lah kadang mau menang lagi kontes tiba-tiba ngelegg sendiri jaringannya dasar game hamaaa ngasih tim selalu yang troll dapet musuh anak imo sedangkan tim masih honor kan rusak game ini,2
Indonesia,"matchmaking lo makin rusak, ton, wkwkwk... gws deh",1
Indonesia,moonton plis lah kok download data yg gak ingin di download tiba tiba download otomatis mana gak bisa di hapus lagi. Tolong perbaiki ini secepatnya 😤,3
Indonesia,"kacau matchmaking kacau! Tim ga balance, main jadi stres. Moonton, kacau gaadil kasih tim gajelas ga seimbang kacauu",2
Indonesia,game anj aplikasi tidak ada tanggapan trs,1
Indonesia,"tolonglah gk bisa kalian cari akun akun yg merugikan rekan tim nya dipermainan cuma carikan,ban,jgn izinkan main udh itu aj kok payah kali kalian. kalo event yg bagusan kali nya kalian buat msa penyesuaian permainannya buruk kali. mungkin karna banyak orng bodoh yg main tu makanya kalian gk mau ban kan 🤬🤬🤬",2
Indonesia,woi muntun kasih musuh yang bener dong!!!!,1
Indonesia,plis moonton masa gua udh bintang 49 turun ke bintang 40 kasih kawan yang ngotak dikit lah moonton jangan darksistem mu,1
