negara,review,rating
Filipina,usa ka lalake karun ang nasakpan o nag buslot o punoan sa saging nag lulu na karun ang isang Bata sa Punoan ng Ka sagingang dedto sa Davao del norte,5
Filipina,The matching is horrible.,1
Filipina,"so laggy barely playable... actually unplayable due to how lag this game is the matchmaking,the draft picking,the game everything is so laggy fix this moonton....not only that whenever i play rank i get pair with lowranks like mythic while im the only one with mythic glory its not fair fix it",1
Filipina,bad customer service,1
Filipina,lag issue 😤😡 network unstoppable 328mns red signal,1
Filipina,good game,4
Filipina,I like this game,5
Filipina,Perfecto ok,5
Filipina,"this game is suck not good to play because I can't change my account and this game is stupid,suck,boring,not fun like free fire.",1
Filipina,i tinhk this ml was human darksistem oke and why season is fast ? i very to immotarl and than is epic or master pliss update don't fast a season,1
Filipina,"very much bug, not balance match, very troll. very money eye developer",1
Filipina,nicee game,5
Filipina,"server lag server lag, bila nak fix oiii",1
Filipina,amazing game,5
Filipina,"You know what no wonders why many people goes to other game name HOK imaggine I got lose streak 30+ time due on you useless matchmaking is that cool? no surprise why you only have 4 star rating unlike tge other game your matchmaking is sucks you know that? you must know your work cause this game getting useless all of a sudden due on you stupid matchmaking You should delete this game if I were uou You are the most useless developer of all time ""MARK THAT""",1
Filipina,"Ranked should be unlocked based on playtime or level. There are too many being carried up. THE HIGHEST RANKED GAMES ARE SO MUCH WORSE. There are a lot of broken heroes - maybe check the ban rates? MAYBE PLAY YOUR OWN GAME? The new patch did jack about broken heroes. This is how you fail players <3 P.S. You don't deserve our money :) RIGGED GAMBLING🔥 They intentionally match you with low MMR player so you keep playing/loosing (Google ""dark system""). Absolute trash heap.",1
Filipina,ayos ka mamigay ng kakampi ah puro walang bitaw,1
Filipina,A good connection is useless in front of King Montoon because they make you feel like you live on Mars and your Wi-Fi is at home. You guys have no shame after all the top-ups the players have made.,1
Filipina,"really this game is good, but not at matchmaking system.",1
Filipina,nag pose yong download resource ko!!🔥💥💥💥😡😡😡,1
Filipina,xjd puji malas nk main,1
Filipina,so bad always make lose streak at the end of season,1
Filipina,game ini sangat bagus,5
Filipina,you're game is so log my ping is oky butt I can't control it properly,2
Filipina,Moonton why you give us Dark system while The enemy is strong Why you Change it to Normal player Vs Normal player not Bad player vs Good player,1
Filipina,love this game,4
Filipina,"stupid game darksystem too manyyyyyy who's doing this game idiot and soo stupid😴 so don't play this game, just skin not the system, always system down👎🏻 so don't play this game serious",1
Filipina,This game is full of hackers and cheaters.,1
Filipina,unfair game,1
Filipina,kupal talaga matchmaking nag sosolo tas kalaba 5man,1
Filipina,give me kof,5
Filipina,goat,5
Filipina,tarantado,5
Filipina,game babi pi buang game hg kat dalam neraka.,2
Filipina,why do i always have bad teammates. give me some good one PLEASE!,2
Filipina,"a great game, I love it",5
Filipina,"im having a trouble with bad teammate in rank, they don't follow their role even though you can choose a role they straight up pick their only know hero, i hope moonton fix this.",1
Filipina,lahat tanga binibigay na kampi pero ang kalaban palo tanginamo ml,1
Filipina,Just downright Horrendous...Server Matchup is an absolute joke....NA getting paired with South American tards...constant flow of garbage players. etc....if you love your sanity stay the F away from this game.,1
Filipina,bad for kid,1
Filipina,game bangsat,1
Filipina,good game but some time to lodge in,4
Filipina,unfair matchmaking mythic solo play all teammates were AI -_- after win streak system will take back all star by giving you AI TEAMMATES*UNFAIR SYSTEM*,1
Filipina,it got many Myanmar and darksistem player,1
Filipina,i take back on my 5 star review they didnt even punish the gusion who didnt attack the minion who got into the base causing me to lose,1
Filipina,I like this game because this is so amazing game,5
Filipina,Worst 5v5 made for people game when in matchmaking only bots even in mythic ranks so just delete it and don't waste your time here,1
Filipina,yanung sma na puro bata na nag lalaro tas mnga klban high points tas kakampi ko maga legend lang tas bata pa sma na nito out n ako,5
Filipina,"Matchmaking sucks, very unbalance. Some players are very toxic, trollers, unskilled, and dark system idiots. This is ridiculous. They're stupid and stubborn useless players. That's why other players were transferred to Honor of Kings because of this issues that still existing for many years until now. Playing in solo rank is a big risk little chance of winning. And also it's very very lagging fps drop even though the net is fine. Many players using VPN that cause lag. Zero star 👎",1
Filipina,"It is a nice game, but not very enjoyable. Here's the thing my phone lags so bad that it shuts down for a whole 7 sec and they reported me for 'being afk"" BUT I'M NOT. This has happened to me many times. That's why I stopped playing ML for two years. The game always talks about how we should always think about our team mates, but doesn't want to listen to our explanation. Rather this game should emphasize being discreet about other players. ML needs to update their rules and regulations.",1
Filipina,it's fine,2
Filipina,need advance server please,5
Filipina,I like this game,5
Filipina,Myin. Myat. Zaw,5
Filipina,The game 🎮 in so beautiful and i like this game,5
Filipina,i really love the game but there is one more problem the graphics,5
Filipina,good game,5
Filipina,it's just the way it is and it's good,5
Filipina,cheap unbalanced ugly lol-wanna be for calculators,1
Filipina,MANY TRASH PLAYER,1
Filipina,"it getting suck and awful games. since dark system controlling the 5vs5, no more fun to continue playing mlbb. matchmaking getting worse. every time when I win 3 game and play the next match, then dark system will match you with teammates is a newbie or maybe a bot..why I said like this because when I try communicate with them no answer. ohh, this is what the senior player called dark system. also the enemy team is powerfull skill. fix the matchmaking system or a lot of player will quited..",1
Filipina,awesome that's all mabuhay,5
Filipina,insane 🔥,5
Filipina,it's ok,5
Filipina,poor matchmaking,1
Filipina,I really like it,5
Filipina,dark system team,1
Filipina,game gajelas orang udah imo masih dikasih tim mythic romawi,1
Filipina,this is the best game forever,5
Filipina,"PUTANG INANG MATCH MAKING YAN, GAGO AMPOTA IPAPASAMA AKO SA TATLONG GUNGONG, NASAN UTAK MO NYAN. WAG NA KAYO MAG DOWNLOAD NETO, NAPAKA UNFAIR. 1 SIDED MASYADO AMPOTA.",1
Filipina,what a amazing game .,5
Filipina,I LOVE IT,5
Filipina,setiap hari kalah moonton tak kasih menang langsung,1
Filipina,game Haram bagi darksestem,1
Filipina,tanginang apps na to mga bobo Kasama lagi dimonyo apps na to tangina tlaga tong ml na to,1
Filipina,bangke,1
Filipina,please remove ur DARKSISTEM,1
Filipina,"when I try to report a toxic or rude player, it doesn't ban them, it banned me because a player targeted me for calling out their friend, who was saber,the toxic player kept running after me and recalling at my body when I died, I called him out but he didn't listen, please actually try reviewing the footages instead of letting ai taking the job.",1
Filipina,"why am i queing with computers???????? i hate this game man, those low quality ai generated pictures dude, they be having 8k/9k mmr with like 2k matches with no expert badge too, u guys do not know how much stars ive lost, im gonna uninstall this game after promo dias i hate this",1
Filipina,the teammates are so dark systems,1
Filipina,That was amazing,4
Filipina,вы эту игру в плей маркет выложили если что❤❤❤,1
Filipina,so hard,5
Filipina,I hate the way the lore just changed like; from childhood sweet hearts to sibling like bond?? it's just not acceptable 💔 yk I'm talking about Hayabusa and kagura lore bruh,1
Filipina,very good bro,5
Filipina,good,5
Filipina,zidan98 zidane98,5
Filipina,I like it,5
Filipina,poor match making experiences . lot of feeders and low skilled level players even in high ranks. The matchmaking is unbalanced . poor experience,1
Filipina,it's good game for future,5
Filipina,bagus tapi ls,4
Filipina,Best MOBA game l have ever seen,5
Filipina,not suggest to play,1
Filipina,Randi ko ban feri noob team dincha Muji Mala Muji ramro team de Randi ko ban haru,1
Filipina,I love this game but there are many dark systems and people trolling,4
Filipina,"I already got my spot nearly to become glory, but it keeps me defeated every time I play. from 38 stars to 33. hell nahhh tenkyuu moontoon to put me in this hell.",3
Filipina,I really love this game,5
Filipina,when I factory reset my phone why I can't get my account,3
Filipina,BRUH THE MATCHMAKING IS SO TRASH I HATE THIS GAME I CAN'T EVEN WIN IN A SINGLE MATCH I ALWYAS GET A MVP LOSS I HATE THIS GAME I HATE THE DEVELOPER THIS GAME IS SUCK!,1
Filipina,Game haram,1
Filipina,"Oke montoon. ini kenapa ya? Setiap login atau dilobby terus terusan ada loading scene (maksudnya: Loading hilang jaringan) Padahal jaringan ada dan bagus malahan. dan Pernah setiap main itu di matchmaking jaringan hijau dan gak bisa dipencet sama sekali, kayaku main gak bisa gerak. Dan itu merugikan sekali montoon. Soalnya yang kena akunku juga, Dapet coklat karena ulah game montoon sendiri padahal udh direlog masih aja. Tolong di betulkan montoon.",3
Filipina,nice game,5
Filipina,pinakakampi mo dark system,1
Filipina,game,5
Filipina,This game is trash!,1
Filipina,"Ang pangit ng match making, immo mga kalaban tas kampi mythic 1star moonton anoo naa????",1
Filipina,A bad game always has a booster player in it,5
Filipina,"Developers of that game is totally retards, and balance system in matches is a trash, where the enemy idiots team appears much stronger than your bots team... Impossible to play, so the better solution is unninstal that pathetic game, and leave a fair review with one star, if impossible there must be zero stars !! Developers, you are brainless tards.",1
Filipina,Been playing the game for 8 years and i left the game because of the match making. The gane has a hidden mmr tht actually matters in matchmaking and it seems they only want the player to keep playing indefinitely. Thts why i switched to honor of kings,3
Filipina,love it,5
Filipina,saya sayang moontun bagi menang selalu ye hehe I love you moontun sihat selalu ye alhamdulilah 😘♥️,5
Filipina,it's so good and I have a good gaming,5
Filipina,"the game was good at first. I got to learn how to use different heroes in classic. But after a few days, every time i play classic, I get put up against collectors or people who are obviously too strong so much so that I dont even have time to level up my characters. i get killed almost immediately. it is very frustrating for me as a newbie who hasnt figured out what character i want to use. If i cant even learn or make any progress by using classic then whats the point of continuing to play?",2
Filipina,"Your players are terrible, matchmaking was trash",5
Filipina,"WHAT'S WRONG MOONTON? I HAVE GOOD NETWORK BUT WHEN I PLAY AND IT SAYS ""MATCH FOUND"" IT DOESN'T GO WHERE I CLICK ""ENTER"" AND I AM NOT ABLE TO PLAY!! PLEASE FIX THIS ASAP.",1
Filipina,Purple Start,5
Filipina,Terrible,1
Filipina,This game is very good I like It,5
Filipina,"F this game, always unbalanced and noob players reaching high ranks",1
Filipina,always lag and unfair Match making,1
Filipina,uninstall tangina ito tinatawag na balace game maka abot ka mythical glory kakampi mga legend mag ka dou tanginang yan uninstall nato lipat nalang ako sa hok mga pormal don kakampi,1
Filipina,It was so good and every hero has an amazing story. The game is also interesting,4
Filipina,defeat,5
Filipina,"i used to love this game back then, but now it's very different to play now because it's always giving you the noob random teammates even you're good at game i hate this game so much its pissing me off",1
Filipina,kuti game bando ki hp hi nhi ja rhi..,1
Filipina,this is the best game it's is the beeeeeest,5
Filipina,ew no,1
Filipina,I love this game it is the best game I ever played,5
Filipina,bad,5
Filipina,Bro this game was so badd and we always get banned for no reason,1
Filipina,i learned how to fight so i can fight my enemies,5
Filipina,ganda subra!,5
Filipina,Not just a game but it's fun,3
Filipina,Game kontol,1
Filipina,not good very toxic game,1
Filipina,"to many darksystem players and can't even fix it, worst game ever. and when you report your teammate about a certain action they have done they wouldn't even take an action for it and you also ban me from matchmaking just because i reported my three chocolate teammates",1
Filipina,so crazy game in the world,5
Filipina,MLbb game is very good I'm like playing games mlbb,5
Filipina,this game makes me mad my teammates are bot while my enemy is like mythic immortal 1000 stars like can you fix your game like I'm in epic I can't escape dark system put epic to epic server not epic to mythic immortal 1000 stars like I'm so mad I quit mlbb,1
Filipina,"GAME BODOH, MATCHMAKING TERBODOH!! SIALL PUNYA GAME",1
Filipina,"I’m honestly so tired of the matchmaking in Mobile Legends. Every single time I get close to Mythical Glory, the system completely ruins it. It feels like the system deliberately stacks the odds against you when you’re about to rank up. I can handle losing fair games, but constantly facing opponents who were previously much higher rank while being paired with weaker teammates makes it impossible to climb. On top of that, the lane role and hero selection system is a complete mess.",2
Filipina,apk,5
Filipina,my ally are all bot,2
Filipina,I never played this game since 2024 and now it shows it's my top hours of play in my gaming status here in google play. That's impossible because I hate the game and don't even have it installed. DELETE MY DATA,1
Filipina,LS MULU KONTOLLLL,1
Filipina,Mobile legends is best game.i love this game so muchh,5
Filipina,This game is so amazing and this game have excellent graphics and world maps.,5
Filipina,TANGINA MO AYUSIN MO LARU MO PATAYIN MO LAHAT NG MALALAKAS NA USER TANGINA MO,1
Filipina,there are issue with selecting heroes in rank. i cant swap out my teammates although theres a button that should allow it.,2
Filipina,it is good,5
Filipina,game gj,1
Filipina,ok na sana yung laro pero yung mga player di marunong mag laro puros dark system at di marunong mag adjust pati main hero ko binan,2
Filipina,I hate this game my team always bot,1
Filipina,im in a match and server is down.. again!,1
Filipina,game gak jelass,1
Filipina,it's very amazing 🎮🎯,5
Filipina,I love it,5
Filipina,best among the rest.,5
Filipina,ကညီဖိ၄၃၂၁,5
Filipina,beautiful game,5
Filipina,"The game is amazing, I recently updated and I love how they've fixed the lag of the waiting lobby, but I wish they could do something about the character selection lag . Over all, it's still my second most favorite game",4
Filipina,I like this game,5
Filipina,bad matchmaking,1
Filipina,"the match making it's so stupid, everytime I play solo you always give an stupid,? like really?, plsss fix your matchmaking!",1
Filipina,worst game,1
Filipina,KARMAHIN MALALA SANA GUMAWA NG MATCHMAKING SYSTEM MO APAKA BOBO!!!,1
Filipina,best game ever,5
Filipina,say no to revamp kadita!!! 😭,5
Filipina,still has one of the most useless teammates.,1
Filipina,good,5
Filipina,"itu server nya di perbaiki,ngelag parah sial",1
Filipina,lapu lapu is good for me I'm mvp,5
Filipina,Good,1
Filipina,this game should go die,1
Filipina,tambah stress🤬🤬🤬,1
Filipina,game burik setiap kali main mesti nak mytic 1 bintang lagi mesti kalah,1
Filipina,nonsense matchmaking system server (2007),1
Filipina,Pin sever teammates bot game,1
Filipina,so nice game,5
Filipina,unfair matchmaking,1
Filipina,moonton your matchmaking is trashh!!!! your game is trash,1
Filipina,dili mag pa change acc way nindot,1
Filipina,moonton semak nk naik mythic dpt team troll,1
Filipina,tang ina Puro nalang black system nakakasama ko ang pangit pa nang picking puroo nalangg galawgaww moontonnn tass yung iba duoo tasss ako soloo yawaa naman nyannnn,1
Filipina,Their costumer service is fast so i really appreciate they retrieve my account back.,5
Filipina,mythic glory jumpa honor mythic honor jumpa mythic biasa ngn legend Kan bangang system moonton bagi lah match Sama rank 2jam aku main semua rank bawah Kau bagi,2
Filipina,"IT'S VERY BAD, UNFAIR TEAMMATES",1
Filipina,you re all about broken mechanics,1
Filipina,Game apasih ini Matchmaking nya gabener mulu dikasih tim yang busuk terus,1
Filipina,isinya ytim smua bro,1
Filipina,subrang ganda,5
Filipina,the best game I ever played,5
Filipina,Good,5
Filipina,I like this game so much,5
Filipina,"Unfair matchmaking, unhealthy environment causing stress",1
Filipina,daming cancer,5
Filipina,I love it but I suggest changing theme rather repeating it,5
Filipina,so good in fighting in lord clash,5
Filipina,5 star verry good,5
Filipina,POTANG INA NIYO MLBB MAS MADAMI PANG Ai KESA TOTOONG TAONG NAG LALARO LAOS NABA KAYA PINASOK NYO NA ANG MGA AI TANG INA NIYO KAWAWA KAMING MGA SOLO PLAYER AYUSIN NIYO BAWASAN NIYO MG AI,1
Filipina,"make it so received reward does not required to click OK/CONFIRM/YES. Unless it was between an option of are you sure then YES/NO, other than that, IT IS A TOTAL USELESS BUTTONSSSS!!!!",3
Filipina,"GRABENG LARO TO, PUNO NG MGA BISAYA.",1
Filipina,"marchmakimg benerin TOLOL, KALAU IMMO YA IMMO AJA AJG",1
Filipina,Good game,5
Filipina,ဆော့ရတာပျော်ဖို့ကောင်တယ်,5
Filipina,game paling menbosankan asyik kalah je,1
Filipina,"When I lose 3-6 times and the next match I win but the next match lose like 2-4 lose, can you fix this Moonton I just want a fair match not always defeat and it looks like I'm good but I still need strong teammate not always weak teammates and when my team is weak then the enemy are strong how that's even fair. I just want a fair match your system taking me to weak team but I'm also weak and I need strong teammate to get stronger but this system I don't like it I want fair match😡",1
Filipina,game mnyushkn org nk naikkan rank kau bgi plk team darksistem mmg lol.,3
Filipina,dark system kakampi,1
Filipina,This game is really nice.,5
Filipina,good,5
Filipina,ts just wild rift but worse,1
Filipina,Good game.,5
Filipina,fix matchmaking barua,1
Filipina,bagus walaupun darksystem,5
Filipina,lwky mid,1
Filipina,poor game,1
Filipina,"mother, fix your game, fix the matchmaking for ten, you loser, you idiot",2
Filipina,The matchmaking in solo ranked games is unfair.,1
Filipina,PANGIT NG MATCH MAKING NIYO MOONTANGERS,1
Filipina,do i even need to explain why this game give so much fun?,4
Filipina,"I have played this game since 2019. This game has been fun to the point that it is addictive. It's been so addictive that I would play it day and night without any notice to the world around me. It made my life crumble to some extent similar to drugs. At the same time, this game matches people with complete imbeciles if you are a good player. This sole reason made me rage a lot at the game. This has altered my personality and made me an irascible person. I would not recommend this to anyone.",1
Filipina,"matching team selalu problem,macam main pau",1
Filipina,"They really know how to f ucking keep people play. lose, win, lose, win. Like no matter how good you are if you're bound to lose, you're gonna lose.",1
Filipina,this is the best game for retarded people if you are brain rot individual just play this game because people in this game are all idiot even the developers because they can't balance the players your team is all retarded that dont event communicate,1
Filipina,"A game with the most Worst Matchmaking and player possible, Plus The protection card is USELESS look I've been losing 3x AND THAT FRICKIN CARD DOESN'T EVEN WORK",1
Filipina,I love mlbb. the best game. ever,5
Filipina,ူ့သ်,1
Filipina,"Unfortunately this past months, Starlight Skin , Collector Skin, Free skin just have the same collor it doesn't seem to have the creativity, looks AI, so sad skins now have very few little concept. Look at the March Collector skin of Tigreal, its just similar to the starlight skins of fredrinn, hilda and freya.",1
Filipina,five stars because it's beautiful and you can enjoy playing it when you're bored,5
Filipina,Very good game.i like it,5
Filipina,never use any illegal program but i got banned,1
Filipina,1 star for this one dumb manipulation of matchmaking and toxic players all around i don't recommend this type of app for the kids all around the world.genuienly the graphics is the only good one in this game nothing more.the creativity is trash asf all they can do is high tech designs to the skins also wth is thr point of this game to annoy or dissapoint players?! Horrible.,1
Filipina,make masha meta,1
Filipina,"Sangat kecewa dengan event King of Fighters ‘97. Saya sudah spend hampir RM500 untuk cuba dapatkan Valir Kyo Kusanagi, tetapi akhirnya hanya dapat Masha Mai Shiranui yang langsung bukan skin yang saya sasarkan. Lebih mengecewakan bila ada kawan saya yang tak spend banyak pun, hanya guna spin murah, tetapi boleh dapat Kyo Kusanagi pada percubaan pertama. Sistem RNG nampak sangat tidak adil. Bila hubungi customer support pun tiada respon yang membantu. Rasa seperti pemain hanya diperah untuk duit.",1
Filipina,pa tanggal ng nandon sa phone ko hindi ko nmn account yon kupal ka din eh,3
Filipina,Dark system as it's finest. Tried to comeback and still trash. Not gonna lie.,1
Filipina,One of the best game! Addicted to this already. 😁,5
Filipina,"It is a good game, but the problem is that: There are some players who cannot portray their roles and usually ending up with a defeat. I do not know how to avoid ""DARK SYSTEM"" players who kept ruining each game. I just want to play with players who don't throw up our game and will do their best to win.",2
Filipina,game tolol matchmaking gaje,1
Filipina,nice,5
Filipina,Total messy match making system.,1
Filipina,gem gj wl wl doang,1
Filipina,very good.,5
Filipina,I have the no payment environment error in the game evwn though i had multiple payments options in Google Play. Please fix this!,1
Filipina,this game is nonsense.it´s all bots player team.,1
Filipina,"always match with noob teammates, or is it bot?",1
Filipina,matchmaking sampah,1
Filipina,"game is great and all but the customer support? NO it's super unreliable I have been trying to get help for over a week and all it says is ""new chat"" I hope they fix this",2
Filipina,Why is the line up in the ranked game so bad? Why can't you just change the rules like you can't invite low rank to high rank so that there is no disappointment in the game.,2
Filipina,It's amazing 😍😍,5
Filipina,Team dbagi darksystem terus..kepala butu moontod..bodoh punya system,1
Filipina,"game bagus dan sangat seru, player ramah dan baik hati, bahkan menghibur semua orang, -nya sering kasih aku ls masa mau naik glory tim nya tolol semua ga dikasi bagus",5
Filipina,I've been playing this game for quite some time now and it's just great. it's very enjoyable and just nice it gives you a peace of mind,5
Filipina,matchmaking is so bad very ugly game improve your matchmaking in time to start da game is so slow in more dark system,1
Filipina,"sistem matchmaking yang tidak adil, memberikan tim yang buruk dengan rank dibawah satu tingkat. dan untuk musuh dibuat setinggi mungkin. game lu rusak, gw udh 29 kali match gabisa nembus ke mhytic 40, ujung ujungnya dari 39 ke 34. tim yang diberikan selalu tim dengan win rate rendah, sedangkan musuh win rate tinggi. percuma kalau sering mvp atau selalu emas tapi kalah edit: sampai sekarang pun sistem game rusak, rank matchmaking rekan tim gap rank nya terlalu jauh, selalu diberi rekan tim deng",1
Filipina,game is boring you need to improve,1
Filipina,every high rank teammate are dark system,1
Filipina,verry goood,5
Filipina,My pocket money is gone....🥀,5
Filipina,i can't play gane because too much game error coming. when i play game goo back automatically. why I don't noo. so fix that problem fast😤😤,1
Filipina,I love the game it's fun and really good but the match making need some fixing there are some players that are trolling and I think personally the report system should be more upgraded so the game should be more strict and players would follow the rules more..,5
Filipina,Bs game,1
Filipina,janfan main mlbb kerana mlbb adalah game tiruan daripada hok,1
Filipina,I love the experience of the game and I love the character,5
Filipina,делают новые скины вместо улучшения механики подбора в рейтинге,1
Filipina,"I always play that game , it only takes time in name",5
Filipina,Matchmaking unfair. Always got mvp but teammates are trolling plus the enemy is very powerful. Somehow enemy's skills are not compatible with their rank since some people are making boost rank account services,1
Filipina,most toxic game. can cause depression and suicidal attempt. don't play with this game. it's like your playing with demons,1
